{
  "schemaVersion": 1,
  "generatedBy": "flix.spec.TokenKindExtractor",
  "toolVersion": "1.0.0",
  "upstreamCommit": "4a5b60a31ac03bb762f68b554a0fc2b6f4d982b9",
  "oracleSha256": "20007d79f97b696ba388113e2a4235227691d33a00bfa669f2316b37a7b14201",
  "tokenKindCount": 159,
  "tokenKindDigest": "d665b11181ef4639282ea5a32d180c0b445c2298fd0ab128c753ee0fd8026887",
  "kinds": [
    {
      "name": "Ampersand",
      "form": "case-object"
    },
    {
      "name": "AngleL",
      "form": "case-object"
    },
    {
      "name": "AngleLEqual",
      "form": "case-object"
    },
    {
      "name": "AngleR",
      "form": "case-object"
    },
    {
      "name": "AngleREqual",
      "form": "case-object"
    },
    {
      "name": "AngledEqual",
      "form": "case-object"
    },
    {
      "name": "AngledPlus",
      "form": "case-object"
    },
    {
      "name": "Annotation",
      "form": "case-object"
    },
    {
      "name": "ArrayHash",
      "form": "case-object"
    },
    {
      "name": "ArrowThickR",
      "form": "case-object"
    },
    {
      "name": "ArrowThinL",
      "form": "case-object"
    },
    {
      "name": "ArrowThinRTight",
      "form": "case-object"
    },
    {
      "name": "ArrowThinRWhitespace",
      "form": "case-object"
    },
    {
      "name": "At",
      "form": "case-object"
    },
    {
      "name": "Backslash",
      "form": "case-object"
    },
    {
      "name": "Bang",
      "form": "case-object"
    },
    {
      "name": "BangEqual",
      "form": "case-object"
    },
    {
      "name": "Bar",
      "form": "case-object"
    },
    {
      "name": "BarHash",
      "form": "case-object"
    },
    {
      "name": "BracketL",
      "form": "case-object"
    },
    {
      "name": "BracketR",
      "form": "case-object"
    },
    {
      "name": "BuiltIn",
      "form": "case-object"
    },
    {
      "name": "Caret",
      "form": "case-object"
    },
    {
      "name": "Colon",
      "form": "case-object"
    },
    {
      "name": "ColonColon",
      "form": "case-object"
    },
    {
      "name": "ColonColonColon",
      "form": "case-object"
    },
    {
      "name": "ColonColonTight",
      "form": "case-object"
    },
    {
      "name": "ColonMinus",
      "form": "case-object"
    },
    {
      "name": "Comma",
      "form": "case-object"
    },
    {
      "name": "CommentBlock",
      "form": "case-object"
    },
    {
      "name": "CommentDoc",
      "form": "case-object"
    },
    {
      "name": "CommentLine",
      "form": "case-object"
    },
    {
      "name": "CurlyL",
      "form": "case-object"
    },
    {
      "name": "CurlyR",
      "form": "case-object"
    },
    {
      "name": "DebugInterpolator",
      "form": "case-object"
    },
    {
      "name": "Dollar",
      "form": "case-object"
    },
    {
      "name": "Dot",
      "form": "case-object"
    },
    {
      "name": "DotWhiteSpace",
      "form": "case-object"
    },
    {
      "name": "Eof",
      "form": "case-object"
    },
    {
      "name": "Equal",
      "form": "case-object"
    },
    {
      "name": "EqualEqual",
      "form": "case-object"
    },
    {
      "name": "Err",
      "form": "case-class"
    },
    {
      "name": "GenericOperator",
      "form": "case-object"
    },
    {
      "name": "Hash",
      "form": "case-object"
    },
    {
      "name": "HashBar",
      "form": "case-object"
    },
    {
      "name": "HashCurlyL",
      "form": "case-object"
    },
    {
      "name": "HashParenL",
      "form": "case-object"
    },
    {
      "name": "HoleAnonymous",
      "form": "case-object"
    },
    {
      "name": "HoleNamed",
      "form": "case-object"
    },
    {
      "name": "HoleVariable",
      "form": "case-object"
    },
    {
      "name": "KeywordAlias",
      "form": "case-object"
    },
    {
      "name": "KeywordAnd",
      "form": "case-object"
    },
    {
      "name": "KeywordAs",
      "form": "case-object"
    },
    {
      "name": "KeywordCase",
      "form": "case-object"
    },
    {
      "name": "KeywordCatch",
      "form": "case-object"
    },
    {
      "name": "KeywordCheckedCast",
      "form": "case-object"
    },
    {
      "name": "KeywordCheckedECast",
      "form": "case-object"
    },
    {
      "name": "KeywordChoose",
      "form": "case-object"
    },
    {
      "name": "KeywordChooseStar",
      "form": "case-object"
    },
    {
      "name": "KeywordDef",
      "form": "case-object"
    },
    {
      "name": "KeywordDiscard",
      "form": "case-object"
    },
    {
      "name": "KeywordEMatch",
      "form": "case-object"
    },
    {
      "name": "KeywordEff",
      "form": "case-object"
    },
    {
      "name": "KeywordElse",
      "form": "case-object"
    },
    {
      "name": "KeywordEnum",
      "form": "case-object"
    },
    {
      "name": "KeywordFalse",
      "form": "case-object"
    },
    {
      "name": "KeywordFix",
      "form": "case-object"
    },
    {
      "name": "KeywordForA",
      "form": "case-object"
    },
    {
      "name": "KeywordForM",
      "form": "case-object"
    },
    {
      "name": "KeywordForall",
      "form": "case-object"
    },
    {
      "name": "KeywordForce",
      "form": "case-object"
    },
    {
      "name": "KeywordForeach",
      "form": "case-object"
    },
    {
      "name": "KeywordFrom",
      "form": "case-object"
    },
    {
      "name": "KeywordHandler",
      "form": "case-object"
    },
    {
      "name": "KeywordIf",
      "form": "case-object"
    },
    {
      "name": "KeywordImport",
      "form": "case-object"
    },
    {
      "name": "KeywordInject",
      "form": "case-object"
    },
    {
      "name": "KeywordInstance",
      "form": "case-object"
    },
    {
      "name": "KeywordInstanceOf",
      "form": "case-object"
    },
    {
      "name": "KeywordInto",
      "form": "case-object"
    },
    {
      "name": "KeywordLazy",
      "form": "case-object"
    },
    {
      "name": "KeywordLet",
      "form": "case-object"
    },
    {
      "name": "KeywordMatch",
      "form": "case-object"
    },
    {
      "name": "KeywordMod",
      "form": "case-object"
    },
    {
      "name": "KeywordMut",
      "form": "case-object"
    },
    {
      "name": "KeywordNew",
      "form": "case-object"
    },
    {
      "name": "KeywordNot",
      "form": "case-object"
    },
    {
      "name": "KeywordNull",
      "form": "case-object"
    },
    {
      "name": "KeywordOpenVariant",
      "form": "case-object"
    },
    {
      "name": "KeywordOpenVariantAs",
      "form": "case-object"
    },
    {
      "name": "KeywordOr",
      "form": "case-object"
    },
    {
      "name": "KeywordPQuery",
      "form": "case-object"
    },
    {
      "name": "KeywordPSolve",
      "form": "case-object"
    },
    {
      "name": "KeywordPar",
      "form": "case-object"
    },
    {
      "name": "KeywordProject",
      "form": "case-object"
    },
    {
      "name": "KeywordPub",
      "form": "case-object"
    },
    {
      "name": "KeywordQuery",
      "form": "case-object"
    },
    {
      "name": "KeywordRedef",
      "form": "case-object"
    },
    {
      "name": "KeywordRegion",
      "form": "case-object"
    },
    {
      "name": "KeywordRestrictable",
      "form": "case-object"
    },
    {
      "name": "KeywordRun",
      "form": "case-object"
    },
    {
      "name": "KeywordRvadd",
      "form": "case-object"
    },
    {
      "name": "KeywordRvand",
      "form": "case-object"
    },
    {
      "name": "KeywordRvnot",
      "form": "case-object"
    },
    {
      "name": "KeywordRvsub",
      "form": "case-object"
    },
    {
      "name": "KeywordSealed",
      "form": "case-object"
    },
    {
      "name": "KeywordSelect",
      "form": "case-object"
    },
    {
      "name": "KeywordSolve",
      "form": "case-object"
    },
    {
      "name": "KeywordSpawn",
      "form": "case-object"
    },
    {
      "name": "KeywordStaticLowercase",
      "form": "case-object"
    },
    {
      "name": "KeywordStaticUppercase",
      "form": "case-object"
    },
    {
      "name": "KeywordStruct",
      "form": "case-object"
    },
    {
      "name": "KeywordSuper",
      "form": "case-object"
    },
    {
      "name": "KeywordThrow",
      "form": "case-object"
    },
    {
      "name": "KeywordTrait",
      "form": "case-object"
    },
    {
      "name": "KeywordTrue",
      "form": "case-object"
    },
    {
      "name": "KeywordTry",
      "form": "case-object"
    },
    {
      "name": "KeywordType",
      "form": "case-object"
    },
    {
      "name": "KeywordUncheckedCast",
      "form": "case-object"
    },
    {
      "name": "KeywordUniv",
      "form": "case-object"
    },
    {
      "name": "KeywordUnsafe",
      "form": "case-object"
    },
    {
      "name": "KeywordUse",
      "form": "case-object"
    },
    {
      "name": "KeywordWhere",
      "form": "case-object"
    },
    {
      "name": "KeywordWith",
      "form": "case-object"
    },
    {
      "name": "KeywordXor",
      "form": "case-object"
    },
    {
      "name": "KeywordXvar",
      "form": "case-object"
    },
    {
      "name": "KeywordYield",
      "form": "case-object"
    },
    {
      "name": "ListHash",
      "form": "case-object"
    },
    {
      "name": "LiteralBigDecimal",
      "form": "case-object"
    },
    {
      "name": "LiteralBigInt",
      "form": "case-object"
    },
    {
      "name": "LiteralChar",
      "form": "case-object"
    },
    {
      "name": "LiteralFloat",
      "form": "case-object"
    },
    {
      "name": "LiteralFloat32",
      "form": "case-object"
    },
    {
      "name": "LiteralFloat64",
      "form": "case-object"
    },
    {
      "name": "LiteralInt",
      "form": "case-object"
    },
    {
      "name": "LiteralInt16",
      "form": "case-object"
    },
    {
      "name": "LiteralInt32",
      "form": "case-object"
    },
    {